{
  "discovery_id": "business_discovery_ferreteria_minorista_v1",
  "language": "es-CO",
  "version": "1.0.0",
  "sector_key": "FERRETERIA_MINORISTA",
  "sector_label": "Ferreteria minorista",
  "country_or_regulation": "CO - IVA, retenciones y PUC comercial",
  "business_type": "comercio minorista de materiales y herramientas",
  "dataset_target": {
    "batch_id": "business_discovery_ferreteria_minorista_v1",
    "dataset_version": "1.0.0",
    "country": "CO",
    "currency": "COP",
    "tax_regime": "iva_responsable",
    "channels": ["web_chat", "whatsapp", "telegram"],
    "volume_profile": "ventas diarias, reposicion semanal y cierre mensual",
    "tenant_scope_note": "Todo acceso debe respetar tenant, proyecto, modo y usuario."
  },
  "business_processes": {
    "sales": {
      "label": "Ventas",
      "events": ["venta mostrador", "cotizacion aprobada"],
      "documents_involved": ["invoice", "delivery_note", "credit_note"],
      "erp_actions": ["validar cliente", "consultar producto", "verificar inventario", "crear factura"],
      "skills_used": ["customer_lookup", "product_lookup", "inventory_check", "create_invoice", "send_invoice", "accounting_post"]
    },
    "purchases": {
      "label": "Compras",
      "events": ["reposicion aprobada", "factura proveedor recibida"],
      "documents_involved": ["purchase_order", "delivery_note", "accounting_entry"],
      "erp_actions": ["leer soporte", "extraer datos", "registrar compra", "contabilizar documento"],
      "skills_used": ["read_document", "extract_invoice_data", "register_expense", "accounting_post", "tax_accountant_advisor"]
    },
    "inventory": {
      "label": "Inventario",
      "events": ["ingreso mercancia", "ajuste por rotura"],
      "documents_involved": ["delivery_note", "accounting_entry", "debit_note"],
      "erp_actions": ["buscar producto", "consultar stock", "explicar movimiento"],
      "skills_used": ["product_lookup", "inventory_check", "business_explain"]
    },
    "accounting": {
      "label": "Contabilidad",
      "events": ["asiento de venta", "conciliacion bancaria"],
      "documents_involved": ["accounting_entry", "bank_statement", "debit_note"],
      "erp_actions": ["leer extracto", "registrar asiento", "revisar impuesto"],
      "skills_used": ["read_document", "accounting_post", "tax_accountant_advisor"]
    },
    "billing": {
      "label": "Facturacion",
      "events": ["venta lista", "envio de factura"],
      "documents_involved": ["invoice", "credit_note", "debit_note"],
      "erp_actions": ["crear factura", "enviar factura", "explicar documento"],
      "skills_used": ["create_invoice", "send_invoice", "business_explain"]
    },
    "reporting": {
      "label": "Reportes",
      "events": ["cierre diario", "revision del mes"],
      "documents_involved": ["invoice", "accounting_entry", "bank_statement"],
      "erp_actions": ["generar reporte", "consultar dataset", "explicar resultado"],
      "skills_used": ["generate_report", "dataset_lookup", "business_explain"]
    }
  },
  "business_documents": {
    "invoice": {
      "origin_event": "venta confirmada",
      "key_fields": ["numero", "fecha", "cliente", "items", "total"],
      "related_skill": "create_invoice"
    },
    "purchase_order": {
      "origin_event": "reposicion aprobada",
      "key_fields": ["numero", "proveedor", "fecha", "items"],
      "related_skill": "register_expense"
    },
    "delivery_note": {
      "origin_event": "entrega o recepcion de mercancia",
      "key_fields": ["numero", "tercero", "items", "cantidades"],
      "related_skill": "inventory_check"
    },
    "credit_note": {
      "origin_event": "devolucion o descuento",
      "key_fields": ["numero", "factura_referencia", "motivo", "valor"],
      "related_skill": "business_explain"
    },
    "debit_note": {
      "origin_event": "ajuste documentado",
      "key_fields": ["numero", "documento_referencia", "motivo", "valor"],
      "related_skill": "accounting_post"
    },
    "accounting_entry": {
      "origin_event": "hecho economico listo para contabilizar",
      "key_fields": ["fecha", "detalle", "cuenta_debito", "cuenta_credito", "valor"],
      "related_skill": "accounting_post"
    },
    "bank_statement": {
      "origin_event": "extracto disponible",
      "key_fields": ["banco", "periodo", "movimientos", "saldo_final"],
      "related_skill": "read_document"
    }
  },
  "operational_flows": [
    {
      "flow_key": "sale_cash",
      "label": "Venta contado",
      "user_request_example": "Necesito facturar una venta de contado.",
      "documents": ["invoice", "accounting_entry"],
      "sequence": [
        { "kind": "event", "value": "venta confirmada" },
        { "kind": "skill", "value": "customer_lookup" },
        { "kind": "skill", "value": "product_lookup" },
        { "kind": "skill", "value": "inventory_check" },
        { "kind": "skill", "value": "create_invoice" },
        { "kind": "skill", "value": "accounting_post" }
      ]
    },
    {
      "flow_key": "sale_credit",
      "label": "Venta credito",
      "user_request_example": "Haz la factura a credito y enviala.",
      "documents": ["invoice", "delivery_note", "accounting_entry"],
      "sequence": [
        { "kind": "event", "value": "pedido aprobado" },
        { "kind": "skill", "value": "customer_lookup" },
        { "kind": "skill", "value": "inventory_check" },
        { "kind": "skill", "value": "create_invoice" },
        { "kind": "skill", "value": "send_invoice" },
        { "kind": "skill", "value": "accounting_post" }
      ]
    },
    {
      "flow_key": "supplier_invoice_capture",
      "label": "Compra proveedor",
      "user_request_example": "Lee esta factura del proveedor y registrala.",
      "documents": ["purchase_order", "delivery_note", "accounting_entry"],
      "sequence": [
        { "kind": "event", "value": "factura proveedor recibida" },
        { "kind": "skill", "value": "read_document" },
        { "kind": "skill", "value": "extract_invoice_data" },
        { "kind": "skill", "value": "register_expense" },
        { "kind": "skill", "value": "accounting_post" }
      ]
    },
    {
      "flow_key": "monthly_reporting",
      "label": "Cierre mensual",
      "user_request_example": "Genera el reporte del mes y explicalo.",
      "documents": ["invoice", "accounting_entry", "bank_statement"],
      "sequence": [
        { "kind": "event", "value": "periodo definido" },
        { "kind": "skill", "value": "generate_report" },
        { "kind": "skill", "value": "business_explain" },
        { "kind": "skill", "value": "tax_accountant_advisor" }
      ]
    }
  ],
  "accounting_rules": {
    "tax": {
      "summary": "Toda venta y compra debe separar base e impuesto.",
      "rules": ["Guardar base e impuesto en cada documento."]
    },
    "vat": {
      "summary": "El IVA generado y descontable se controla por separado.",
      "rules": ["La venta registra IVA generado.", "La compra valida IVA descontable."]
    },
    "withholding": {
      "summary": "Las retenciones dependen del tercero y el concepto.",
      "rules": ["Revisar retencion antes del pago."]
    },
    "payment_types": ["efectivo", "transferencia", "tarjeta", "credito"],
    "credit_sales": {
      "summary": "La venta a credito exige fecha de vencimiento.",
      "rules": ["Toda venta a credito debe crear cartera."]
    },
    "inventory_cost": {
      "summary": "No se factura sin validar existencias.",
      "rules": ["Toda salida debe dejar trazabilidad documental."]
    },
    "cost_of_goods_sold": {
      "summary": "El costo de ventas se reconoce al entregar mercancia.",
      "rules": ["Separar ingreso y costo en el asiento."]
    },
    "chart_of_accounts_min": [
      { "code": "110505", "name": "Caja general" },
      { "code": "111005", "name": "Bancos" },
      { "code": "130505", "name": "Clientes nacionales" },
      { "code": "143505", "name": "Inventario mercancias" },
      { "code": "220505", "name": "Proveedores nacionales" },
      { "code": "240805", "name": "IVA generado" },
      { "code": "413595", "name": "Ingresos por ventas" },
      { "code": "613595", "name": "Costo de ventas" }
    ],
    "posting_rules": [
      { "trigger": "factura_contado", "debit_account": "110505", "credit_account": "413595" },
      { "trigger": "factura_credito", "debit_account": "130505", "credit_account": "413595" },
      { "trigger": "compra_inventario", "debit_account": "143505", "credit_account": "220505" },
      { "trigger": "pago_proveedor", "debit_account": "220505", "credit_account": "111005" }
    ]
  },
  "sector_terminology": [
    {
      "term": "factura",
      "type": "document",
      "related_skill": "create_invoice",
      "synonyms": ["factura de venta", "documento de cobro"],
      "common_phrases": ["crear factura"],
      "how_users_ask": ["me falta facturar esa venta"]
    },
    {
      "term": "inventario",
      "type": "resource",
      "related_skill": "inventory_check",
      "synonyms": ["existencias", "stock"],
      "common_phrases": ["revisar inventario"],
      "how_users_ask": ["hay material disponible"]
    },
    {
      "term": "cliente",
      "type": "party",
      "related_skill": "customer_lookup",
      "synonyms": ["comprador", "tercero"],
      "common_phrases": ["buscar cliente"],
      "how_users_ask": ["ese cliente ya existe"]
    },
    {
      "term": "reporte",
      "type": "analysis",
      "related_skill": "generate_report",
      "synonyms": ["informe", "resumen"],
      "common_phrases": ["generar reporte"],
      "how_users_ask": ["quiero el resumen del mes"]
    }
  ],
  "frequent_business_questions": [
    { "question": "Como creo una factura de venta?", "answer": "Valida cliente, items y total antes de emitir la factura.", "related_skill": "create_invoice", "related_process": "billing", "tags": ["facturacion"] },